{
  "schema_version": "1.0",
  "operation": "pdf.create",
  "output": "replace-with-output.pdf",
  "arguments": {
    "document": {
      "metadata": {
        "title": "Tokenized report",
        "author": "Elftia",
        "subject": "Typed PDF design tokens"
      },
      "design_tokens": {
        "page_size": "A4",
        "margin": {
          "top": 54,
          "right": 54,
          "bottom": 54,
          "left": 54
        },
        "palette": {
          "ink": [0.08, 0.1, 0.14],
          "accent": [0.12, 0.42, 0.78]
        },
        "typography": {
          "heading": {
            "color": "accent",
            "font_size": 22,
            "line_height": 28
          },
          "paragraph": {
            "color": "ink",
            "font_size": 11,
            "line_height": 16
          }
        },
        "spacing": {
          "heading_gap": 12,
          "paragraph_gap": 10
        }
      },
      "pages": [
        {
          "overflow_policy": "paginate",
          "widow_lines": 2,
          "orphan_lines": 2,
          "blocks": [
            {
              "type": "heading",
              "text": "Quarterly report",
              "style": null,
              "table": null,
              "image": null,
              "shape": null
            },
            {
              "type": "paragraph",
              "text": "Replace this paragraph with the validated report body.",
              "style": null,
              "table": null,
              "image": null,
              "shape": null
            }
          ],
          "metadata": null
        }
      ]
    }
  }
}
